{
  "kind": "blanche.osint-report",
  "schemaVersion": "1.0.0",
  "reportMetadata": {
    "reportId": "osint_mufsorae_d51f9e55-a222-42ab-b069-56f75d8e89e8",
    "generatedAt": "2026-09-24T17:17:37.190Z",
    "generatedBy": {
      "product": "BLANCHE",
      "component": "osint-orchestrator/cli",
      "version": "0.1.0"
    },
    "seedId": "seed_mufsoq41_2cb99016-0610-4cea-a523-85ba9b9f1ce4"
  },
  "scope": {
    "mode": "public-passive",
    "allowedActivities": [
      "Resolve public DNS records for in-scope hosts.",
      "Fetch public web resources such as /, robots.txt, sitemap.xml, and /.well-known/security.txt.",
      "Inspect public TLS certificate metadata presented by the target host.",
      "Run approved passive OSINT tools with non-intrusive discovery flags only."
    ],
    "disallowedActivities": [
      "Do not authenticate, brute force, fuzz, exploit, scan ports broadly, or validate vulnerabilities.",
      "Do not collect non-public information or bypass access controls.",
      "Do not assign severity or represent informational OSINT as validated findings.",
      "Do not replace existing ProdPT testing workflows; this output is preparatory context."
    ],
    "operatorNotes": [
      "Outputs are informational and intended to guide follow-on testing, not validate security impact."
    ]
  },
  "target": {
    "primaryHostname": "www.wellsfargo.com",
    "apparentRootDomain": "wellsfargo.com",
    "targetUrl": "https://www.wellsfargo.com",
    "targetOrigin": "https://www.wellsfargo.com",
    "relatedHostnames": []
  },
  "seed": {
    "kind": "blanche.osint-seed",
    "schemaVersion": "1.0.0",
    "seedMetadata": {
      "seedId": "seed_mufsoq41_2cb99016-0610-4cea-a523-85ba9b9f1ce4",
      "createdAt": "2026-09-24T17:17:35.666Z",
      "generatedBy": {
        "product": "BLANCHE",
        "component": "osint-orchestrator/cli",
        "version": "0.1.0"
      }
    },
    "scope": {
      "mode": "public-passive",
      "allowedActivities": [
        "Resolve public DNS records for in-scope hosts.",
        "Fetch public web resources such as /, robots.txt, sitemap.xml, and /.well-known/security.txt.",
        "Inspect public TLS certificate metadata presented by the target host.",
        "Run approved passive OSINT tools with non-intrusive discovery flags only."
      ],
      "disallowedActivities": [
        "Do not authenticate, brute force, fuzz, exploit, scan ports broadly, or validate vulnerabilities.",
        "Do not collect non-public information or bypass access controls.",
        "Do not assign severity or represent informational OSINT as validated findings.",
        "Do not replace existing ProdPT testing workflows; this output is preparatory context."
      ],
      "operatorNotes": [
        "Outputs are informational and intended to guide follow-on testing, not validate security impact."
      ]
    },
    "seed": {
      "targetUrl": "https://www.wellsfargo.com",
      "targetOrigin": "https://www.wellsfargo.com",
      "primaryHostname": "www.wellsfargo.com",
      "apparentRootDomain": "wellsfargo.com",
      "sourceType": "manual"
    },
    "browserContext": {
      "pageUrl": "https://www.wellsfargo.com",
      "pageOrigin": "https://www.wellsfargo.com",
      "apparentRootDomain": "wellsfargo.com",
      "relatedHosts": [],
      "signals": {}
    },
    "warnings": [
      {
        "code": "MANUAL_SEED_CREATED",
        "message": "The OSINT run used a manually provided target instead of a Chromium-derived seed.",
        "severity": "info"
      }
    ]
  },
  "toolExecutions": [
    {
      "toolId": "builtin-dns",
      "name": "Built-in DNS Collector",
      "mode": "builtin",
      "status": "completed",
      "target": "wellsfargo.com",
      "startedAt": "2026-09-24T17:17:35.667Z",
      "finishedAt": "2026-09-24T17:17:35.954Z",
      "outputCount": 6,
      "warnings": [],
      "errors": []
    },
    {
      "toolId": "builtin-http",
      "name": "Built-in HTTP Surface Collector",
      "mode": "builtin",
      "status": "completed",
      "target": "www.wellsfargo.com",
      "startedAt": "2026-09-24T17:17:35.668Z",
      "finishedAt": "2026-09-24T17:17:37.189Z",
      "outputCount": 4,
      "warnings": [
        "security.txt was not publicly available at https://www.wellsfargo.com/.well-known/security.txt."
      ],
      "errors": []
    },
    {
      "toolId": "builtin-tls",
      "name": "Built-in TLS Collector",
      "mode": "builtin",
      "status": "completed",
      "target": "www.wellsfargo.com",
      "startedAt": "2026-09-24T17:17:35.709Z",
      "finishedAt": "2026-09-24T17:17:35.734Z",
      "outputCount": 1,
      "warnings": [],
      "errors": []
    }
  ],
  "findings": [
    {
      "findingId": "finding_mufsoq5b_2556813d-cb31-489e-b08d-55d09b897902",
      "category": "dns-record",
      "title": "DNS A records for www.wellsfargo.com",
      "description": "Public DNS resolution returned A data for www.wellsfargo.com.",
      "target": "www.wellsfargo.com",
      "confidence": "high",
      "sourceTools": [
        "builtin-dns"
      ],
      "tags": [
        "dns",
        "a"
      ],
      "evidence": {
        "recordType": "A",
        "target": "www.wellsfargo.com",
        "records": [
          "23.214.22.136",
          "23.214.22.138"
        ]
      }
    },
    {
      "findingId": "finding_mufsoq5k_fd54fd12-e6e6-4a62-bc2e-0a3500562b35",
      "category": "dns-record",
      "title": "DNS CNAME records for www.wellsfargo.com",
      "description": "Public DNS resolution returned CNAME data for www.wellsfargo.com.",
      "target": "www.wellsfargo.com",
      "confidence": "high",
      "sourceTools": [
        "builtin-dns"
      ],
      "tags": [
        "dns",
        "cname"
      ],
      "evidence": {
        "recordType": "CNAME",
        "target": "www.wellsfargo.com",
        "records": [
          "www.wellsfargo.com.edgekey.net"
        ]
      }
    },
    {
      "findingId": "finding_mufsoq84_19bcf847-9cc8-470c-b52c-e25e0f0e5355",
      "category": "dns-record",
      "title": "DNS MX records for wellsfargo.com",
      "description": "Public DNS resolution returned MX data for wellsfargo.com.",
      "target": "wellsfargo.com",
      "confidence": "high",
      "sourceTools": [
        "builtin-dns"
      ],
      "tags": [
        "dns",
        "mx"
      ],
      "evidence": {
        "recordType": "MX",
        "target": "wellsfargo.com",
        "records": [
          {
            "exchange": "mxa-00004003.gslb.pphosted.com",
            "priority": 10
          },
          {
            "exchange": "mxb-00004003.gslb.pphosted.com",
            "priority": 10
          }
        ]
      }
    },
    {
      "findingId": "finding_mufsoq8e_168e8455-50eb-4f80-93f2-e5ec653edb5d",
      "category": "dns-record",
      "title": "DNS NS records for wellsfargo.com",
      "description": "Public DNS resolution returned NS data for wellsfargo.com.",
      "target": "wellsfargo.com",
      "confidence": "high",
      "sourceTools": [
        "builtin-dns"
      ],
      "tags": [
        "dns",
        "ns"
      ],
      "evidence": {
        "recordType": "NS",
        "target": "wellsfargo.com",
        "records": [
          "edns1.ultradns.org",
          "a1-189.akam.net",
          "a24-66.akam.net",
          "a2-64.akam.net",
          "edns1.ultradns.biz",
          "edns1.ultradns.com",
          "edns1.ultradns.net"
        ]
      }
    },
    {
      "findingId": "finding_mufsoq9g_41211319-3593-4d4f-bef4-c7ef82cedd9b",
      "category": "dns-record",
      "title": "DNS TXT records for wellsfargo.com",
      "description": "Public DNS resolution returned TXT data for wellsfargo.com.",
      "target": "wellsfargo.com",
      "confidence": "high",
      "sourceTools": [
        "builtin-dns"
      ],
      "tags": [
        "dns",
        "txt"
      ],
      "evidence": {
        "recordType": "TXT",
        "target": "wellsfargo.com",
        "records": [
          [
            "atlassian-domain-verification=3iSn26f6aafKa7o1mfwsx1tZl9Ach7BhUpRmglO24La1WPXoyanfEd3zs1Y0VqiL"
          ],
          [
            "MS=ms55239285"
          ],
          [
            "XKNBNPXX3FGJAJI4IGHIWBRYY6IBLYJKA9TFFIQU"
          ],
          [
            "SFMC-RBMdi4jKmGLzx309qUUmF_jRLq0ZhtELtiy7L3Qh"
          ],
          [
            "docusign=182ba0bd-f7cc-423a-b69f-6597f3418125"
          ],
          [
            "docusign=fa86331e-ce88-4150-9e03-49999c4542a5"
          ],
          [
            "v=spf1 include:%{ir}.%{v}.%{d}.spf.has.pphosted.com ~all"
          ],
          [
            "mongodb-site-verification=jqcFvnzHPnWaB8kuVRCCbrQN1zJQRPQT"
          ],
          [
            "mongodb-site-verification=pdRPv2gbrHzIqdzHpPtCUwOMZBHgPbIQ"
          ],
          [
            "facebook-domain-verification=5m0hrk0snw5sgvxwxdump2kob1wm5u"
          ],
          [
            "poppulo-domain-verification=a43ab4c6-cf0c-408d-892c-910d39b46aec"
          ],
          [
            "slack-domain-verification=TZylPJmHnWc38hjAZndFjbqpORzFahh0CXOLCYBI"
          ],
          [
            "yahoo-verification-key=obqVt160b6+HxLHztMj4LYjtSIXf2WUl7wuBDv+AZpE="
          ],
          [
            "google-site-verification=I_ja-LuIqEJ76WNc4saij8AC-JrnkDqe3--MBdH2LHU"
          ],
          [
            "google-site-verification=JhIekmpe90l9Nsvux7qqfwNmrhbJDI1xKSXsMWlXzYs"
          ],
          [
            "apple-domain-verification=fjpdn_0YZHIPxbMISJedC6zNIlntneK35XOgGcoDH_M"
          ],
          [
            "liveramp-site-verification=eTqekxddhK8on3hD12UkjC56Be8HZGRuzGG9BwQxfRM"
          ],
          [
            "hcp-domain-verification=bed540868e214034c62df7863b2f90e7b217905a6c69831138e93312bcca62c2"
          ],
          [
            "cisco-ci-domain-verification=60939a4d2f539880950cf4f6cd4e97b18a07e85391ff5671f2b7045b2be84f9"
          ],
          [